{
  "$schema": "http://json-schema.org/draft-07/schema#",
  "$id": "pipeline-schema.json",
  "title": "PipelineConfig",
  "description": "Schema for pipeline configuration objects passed to the orchestrator skill (SKL-010). Supports both flat (skills[]) and phased (phases[]) pipeline formats.",
  "$comment": "schema-version: 2.1.0",
  "type": "object",
  "additionalProperties": false,
  "properties": {
    "$schema": {
      "type": "string",
      "description": "JSON Schema reference."
    },
    "name": {
      "type": "string",
      "description": "Unique pipeline identifier (slug format, e.g. 'full-pipeline')."
    },
    "version": {
      "type": "string",
      "pattern": "^\\d+\\.\\d+\\.\\d+$",
      "description": "Semver version of this pipeline config."
    },
    "description": {
      "type": "string",
      "description": "Human-readable description of the pipeline's purpose and intended use."
    },
    "domain": {
      "type": "string",
      "enum": ["ai_agent", "mobile", "saas", "embedded_iot", "web", "api", "data", "data_ml", "microservices", "serverless_edge", "general"],
      "description": "Optional domain classifier for specialist pipelines. Enables domain-aware skill routing and constraint injection."
    },
    "mode": {
      "type": "string",
      "enum": ["sequential", "parallel", "hybrid"],
      "default": "sequential",
      "description": "Execution mode. sequential runs skills one by one. parallel runs independent groups concurrently. hybrid uses parallel_groups definition."
    },
    "skills": {
      "type": "array",
      "minItems": 1,
      "description": "Flat ordered list of skills (simple pipeline format). Use this OR phases[], not both.",
      "items": { "$ref": "#/$defs/skill_step" }
    },
    "phases": {
      "type": "array",
      "minItems": 1,
      "description": "Ordered list of pipeline phases (structured pipeline format). Use this OR skills[], not both.",
      "items": {
        "type": "object",
        "required": ["id", "label", "skills"],
        "additionalProperties": false,
        "properties": {
          "id": {
            "type": "string",
            "description": "Unique phase identifier (e.g. 'phase-1-requirements')."
          },
          "label": {
            "type": "string",
            "description": "Human-readable phase label shown in progress UIs."
          },
          "parallel": {
            "type": "boolean",
            "default": false,
            "description": "If true, all skills in this phase run concurrently."
          },
          "condition": {
            "type": "string",
            "description": "Expression evaluated before running the phase. Phase is skipped if falsy."
          },
          "async": {
            "type": "boolean",
            "default": false,
            "description": "If true, the phase runs asynchronously (fire-and-forget) and does not block pipeline progression."
          },
          "note": {
            "type": "string",
            "description": "Optional human-readable annotation for this phase. Shown in progress UIs and pipeline documentation."
          },
          "config": {
            "type": "object",
            "description": "Phase-level runtime configuration, such as deterministic trigger definitions for conditional phases."
          },
          "skills": {
            "type": "array",
            "minItems": 1,
            "items": { "$ref": "#/$defs/skill_step" }
          }
        }
      }
    },
    "parallel_groups": {
      "type": "array",
      "description": "Groups of skill names that can execute concurrently. Only used when mode is 'parallel' or 'hybrid'.",
      "items": {
        "type": "array",
        "minItems": 2,
        "items": { "type": "string" }
      }
    },
    "gates": {
      "type": "array",
      "minItems": 1,
      "description": "HITL and validation gates that pause or block pipeline progression. If declared, must contain at least one gate — an empty gates array is not schema-valid.",
      "items": { "$ref": "#/$defs/gate" }
    },
    "recovery": {
      "type": "object",
      "additionalProperties": false,
      "description": "Recovery configuration when a critical failure occurs.",
      "properties": {
        "on_critical_failure": {
          "type": "string",
          "description": "Skill name to invoke on critical failure (typically 'rollback-manager')."
        },
        "max_repair_iterations": {
          "type": "integer",
          "minimum": 1,
          "maximum": 5,
          "description": "Maximum repair loop iterations before aborting."
        },
        "rollback_scope": {
          "type": "string",
          "enum": ["pipeline_stage", "pipeline_run", "full_system"],
          "description": "Scope of rollback when recovery is triggered."
        }
      }
    },
    "async_skills": {
      "type": "array",
      "description": "Names of skills that run asynchronously (fire-and-forget). Must match skill names defined in skills[] or phases[].",
      "items": { "type": "string" }
    },
    "on_failure": {
      "type": "string",
      "enum": ["halt", "skip", "rollback"],
      "default": "halt",
      "description": "Behavior when a skill fails all retries. halt stops the pipeline. skip continues to next skill. rollback triggers rollback-manager."
    },
    "full_trace": {
      "type": "boolean",
      "default": false,
      "description": "If true, all intermediate artifacts are retained in the pipeline result. Increases token usage significantly."
    },
    "resumable": {
      "type": "boolean",
      "default": false,
      "description": "If true, the pipeline supports resume_from_phase — HITL rejections can resume from any prior phase without restarting from phase 1."
    },
    "token_policy": {
      "type": "object",
      "additionalProperties": false,
      "description": "Token budget and auto-compression policy for this pipeline (governance §7).",
      "required": ["auto_compress", "trigger_at_percent", "budget_tiers"],
      "properties": {
        "auto_compress": {
          "type": "boolean",
          "description": "If true, context-compressor is triggered automatically when context pressure reaches trigger_at_percent."
        },
        "trigger_at_percent": {
          "type": "integer",
          "minimum": 50,
          "maximum": 99,
          "description": "Percentage of the active budget ceiling at which auto-compression fires."
        },
        "default_tier": {
          "type": "string",
          "enum": ["standard", "large", "xl"],
          "description": "Default budget tier for this pipeline. Orchestrator uses this tier when no per-phase override is set."
        },
        "externalize_threshold": {
          "type": "integer",
          "minimum": 1000,
          "description": "Token count above which eligible artifact payloads are externalized to disk (TASK-0069). Default: 8000."
        },
        "budget_tiers": {
          "type": "array",
          "minItems": 1,
          "description": "Available budget tiers. Each tier defines a ceiling and cascade mode.",
          "items": {
            "type": "object",
            "required": ["name", "ceiling", "cascade_mode"],
            "additionalProperties": false,
            "properties": {
              "name":         { "type": "string", "enum": ["standard", "large", "xl"] },
              "ceiling":      { "type": "integer", "minimum": 1000 },
              "cascade_mode": { "type": "string", "enum": ["single_pass", "cascade"] }
            }
          }
        }
      }
    },
    "batch_policy": {
      "type": "object",
      "additionalProperties": false,
      "description": "Anthropic Batch API routing policy for eligible non-blocking skills (TASK-0070). Disabled by default.",
      "properties": {
        "enabled": {
          "type": "boolean",
          "default": false,
          "description": "Set true to route eligible_skills through Batch API (50% cost reduction, up to 24h latency)."
        },
        "mode": {
          "type": "string",
          "enum": ["async", "sync_override"],
          "description": "async: submit to Batch API; sync_override: force synchronous invocation."
        },
        "eligible_skills": {
          "type": "array",
          "items": { "type": "string" },
          "description": "Skill names eligible for batch routing. Must not include any skill that gates a downstream pipeline phase."
        },
        "comment": {
          "type": "string",
          "description": "Human-readable note for pipeline maintainers."
        }
      }
    },
    "hitl_presets": {
      "type": "object",
      "description": "Named human-oversight presets selected explicitly by the runtime.",
      "additionalProperties": {
        "type": "object",
        "additionalProperties": false,
        "properties": {
          "description": { "type": "string" },
          "restores_gate_ids": { "type": "array", "items": { "type": "string" } },
          "note": { "type": "string" }
        }
      }
    },
    "_async_skills_note": {
      "type": "string",
      "description": "Maintainer-only explanation of async routing decisions; not runtime input."
    }
  },
  "oneOf": [
    { "required": ["skills"] },
    { "required": ["phases"] }
  ],
  "$defs": {
    "skill_step": {
      "type": "object",
      "required": ["name"],
      "additionalProperties": false,
      "description": "A single skill invocation within a pipeline.",
      "properties": {
        "name": {
          "type": "string",
          "description": "Skill name as registered in skills/index.yaml (e.g. 'requirement-analyzer')."
        },
        "version": {
          "type": "string",
          "pattern": "^\\^?\\d+\\.\\d+\\.\\d+$",
          "description": "Semver or semver-range for the skill version. If omitted, latest is used."
        },
        "inputs": {
          "type": "object",
          "description": "Static input overrides for this skill."
        },
        "skip_validation": {
          "type": "boolean",
          "default": false,
          "description": "If true, skips schema validation of this skill's output."
        },
        "max_retries": {
          "type": "integer",
          "minimum": 0,
          "maximum": 5,
          "default": 2,
          "description": "Maximum retry attempts before the pipeline halts this step."
        },
        "async": {
          "type": "boolean",
          "default": false,
          "description": "If true, skill runs asynchronously and does not block pipeline progression."
        },
        "type": {
          "type": "string",
          "enum": ["skill", "validation_check"],
          "default": "skill",
          "description": "Execution type. validation_check skills must emit a verdict field (pass/block). A block verdict halts the pipeline."
        },
        "config": {
          "type": "object",
          "description": "Domain-specific configuration passed to the skill invocation (e.g. domain constraints, guard thresholds)."
        },
        "input_overrides": {
          "type": "object",
          "description": "Runtime input overrides merged with static inputs before skill execution."
        },
        "note": {
          "type": "string",
          "description": "Optional human-readable annotation for this skill step. Shown in pipeline documentation and trace logs."
        }
      }
    },
    "gate": {
      "type": "object",
      "required": ["type"],
      "additionalProperties": false,
      "description": "A gate that pauses or blocks pipeline progression.",
      "if": {
        "properties": { "timeout": { "const": 0 } },
        "required": ["timeout"]
      },
      "then": {
        "properties": { "bypass_on_timeout": { "const": false } }
      },
      "properties": {
        "gate_id": {
          "type": "string",
          "pattern": "^[A-Z][A-Z0-9-]*$",
          "description": "Stable identifier for audit, reporting, and preset selection."
        },
        "after_skill": {
          "type": "string",
          "description": "Gate fires after this skill name completes (flat pipeline format)."
        },
        "after_phase": {
          "type": "string",
          "description": "Gate fires after this phase ID completes (phases pipeline format)."
        },
        "type": {
          "type": "string",
          "enum": ["human_approval", "validation_check", "condition", "auto"],
          "description": "Gate enforcement mode. human_approval requires user confirmation. validation_check auto-passes if output is valid. condition evaluates a JS-like expression. auto is an alias for condition."
        },
        "condition": {
          "type": "string",
          "description": "Expression evaluated against prior skill/phase output. Required when type is 'condition' or 'auto'."
        },
        "timeout": {
          "type": "integer",
          "minimum": 0,
          "description": "Seconds to wait for manual gate approval. 0 = wait indefinitely. Default: 3600.",
          "default": 3600
        },
        "bypass_on_timeout": {
          "type": "boolean",
          "description": "REQUIRED on every human_approval gate (declare explicitly; never rely on defaults). If true, gate auto-continues when timeout is reached. May be true only with timeout_expiry_action:'continue_by_policy' plus a registered policy_exception, and never for security/deployment/release/completeness/governance-change/force-proceed gates (enforced by scripts/validate-pipeline-gates.py). Timeout expiry otherwise means BLOCKED + escalate."
        },
        "timeout_expiry_action": {
          "type": "string",
          "enum": ["continue_by_policy"],
          "description": "Required when bypass_on_timeout is true. Only 'continue_by_policy' is permitted, and only with a registered policy_exception."
        },
        "policy_exception": {
          "type": "string",
          "minLength": 1,
          "description": "Registered exception id from config/gate-timeout-exceptions.json authorizing bypass_on_timeout:true. Absent registry means no exceptions exist."
        },
        "max_extensions": {
          "type": "integer",
          "minimum": 1,
          "maximum": 2,
          "description": "REQUIRED on any gate offering an EXTEND choice (e.g. EXTEND_REVISIONS). Bounds the number of granted extension rounds; exhausted extensions leave only abort/force-proceed. Maximum 2."
        },
        "label": {
          "type": "string",
          "description": "Human-readable label shown in the approval request UI."
        },
        "note": {
          "type": "string",
          "description": "Optional human-readable annotation for this gate. Shown in pipeline documentation and approval UIs."
        },
        "choices": {
          "type": "array",
          "minItems": 1,
          "items": { "type": "string" },
          "description": "Explicit user choices accepted by a human-approval gate."
        },
        "on_choice": {
          "type": "object",
          "additionalProperties": {
            "type": "object",
            "description": "Runtime action configuration for the corresponding user choice."
          },
          "description": "Choice-to-action map interpreted by the orchestrator."
        },
        "skip_condition": {
          "type": "string",
          "description": "Expression that explicitly skips a gate, for example in CI mode."
        },
        "skip_log_reason": {
          "type": "string",
          "description": "Audit reason recorded when skip_condition is true."
        },
        "artifacts_presented": {
          "type": "array",
          "items": { "type": "string" },
          "description": "Artifact references that must be shown to the human approver."
        },
        "re_invoke_on_pattern": {
          "type": "object",
          "description": "When a human_approval gate receives a text reply matching 'pattern', re-invoke the named skill with the injected inputs. Supports capturing groups in 'inject' values via $N references.",
          "additionalProperties": false,
          "required": ["pattern", "skill", "inject"],
          "properties": {
            "pattern": {
              "type": "string",
              "description": "Regular expression matched against the user's reply text."
            },
            "skill": {
              "type": "string",
              "description": "Skill name to re-invoke when the pattern matches."
            },
            "inject": {
              "type": "object",
              "description": "Input fields to inject into the skill invocation. Values may reference capture groups as $1, $2, etc."
            }
          }
        }
      }
    }
  }
}
